{
  "$schema": "https://json-schema.org/draft/2020-12/schema",
  "$id": "https://appsec-advisor/schemas/route-inventory.schema.json",
  "title": "Route Inventory",
  "description": "Deterministic route-extractor output ($OUTPUT_DIR/.route-inventory.json). Feeds Phase 6 attack_surface[] and the architecture-coverage engine. NOT a replacement for attack_surface[]; it is the raw upstream basis with file/line/authn/authz signals.",
  "type": "object",
  "required": ["version", "routes", "coverage"],
  "additionalProperties": false,
  "properties": {
    "version": {
      "type": "integer",
      "const": 1
    },
    "generated_at": {
      "type": "string",
      "description": "ISO-8601 UTC timestamp."
    },
    "repo_root": {
      "type": "string"
    },
    "routes": {
      "type": "array",
      "items": { "$ref": "#/$defs/route" }
    },
    "coverage": {
      "type": "object",
      "required": ["frameworks_detected", "unsupported_route_files"],
      "additionalProperties": false,
      "properties": {
        "frameworks_detected": {
          "type": "array",
          "items": { "type": "string" },
          "uniqueItems": true
        },
        "unsupported_route_files": {
          "type": "array",
          "items": { "type": "string" },
          "uniqueItems": true,
          "description": "Files that look router-shaped but no MVP pattern matched."
        },
        "route_count": {
          "type": "integer",
          "minimum": 0
        },
        "management_surface_count": {
          "type": "integer",
          "minimum": 0
        },
        "missing_auth_suspect_count": {
          "type": "integer",
          "minimum": 0
        },
        "missing_authz_suspect_count": {
          "type": "integer",
          "minimum": 0
        },
        "authenticated_count": {
          "type": "integer",
          "minimum": 0,
          "description": "Routes whose authentication is present (FE-14)."
        },
        "authn_absent_count": {
          "type": "integer",
          "minimum": 0,
          "description": "Routes whose authentication the inventory proved absent (FE-14)."
        },
        "authn_unknown_count": {
          "type": "integer",
          "minimum": 0,
          "description": "Routes whose authentication is neither proven present nor proven absent."
        }
      }
    }
  },
  "$defs": {
    "route": {
      "type": "object",
      "required": [
        "route_id",
        "method",
        "path",
        "framework",
        "handler_file",
        "handler_line",
        "authn_signal",
        "authz_signal",
        "management_surface",
        "confidence"
      ],
      "additionalProperties": false,
      "properties": {
        "route_id": {
          "type": "string",
          "pattern": "^R-[0-9]{3,5}$"
        },
        "method": {
          "type": "string",
          "enum": [
            "GET", "POST", "PUT", "PATCH", "DELETE", "HEAD", "OPTIONS",
            "ANY", "ALL", "GRAPHQL", "UNKNOWN"
          ]
        },
        "path": {
          "type": "string",
          "description": "Route path as written in source. Not normalised; framework-shaped placeholders kept verbatim (e.g. ':id', '{id}', '<id>')."
        },
        "framework": {
          "type": "string",
          "enum": [
            "express",
            "koa",
            "fastify",
            "hapi",
            "nestjs",
            "fastapi",
            "flask",
            "django",
            "spring",
            "jaxrs",
            "aspnet-minimal",
            "graphql",
            "rails",
            "laravel",
            "gin",
            "echo",
            "unknown"
          ]
        },
        "handler_file": {
          "type": "string",
          "description": "Repo-relative POSIX path."
        },
        "handler_line": {
          "type": "integer",
          "minimum": 1
        },
        "authn_signal": {
          "$ref": "#/$defs/auth_signal"
        },
        "authz_signal": {
          "$ref": "#/$defs/auth_signal"
        },
        "management_surface": {
          "type": "boolean",
          "description": "True if the route looks like an admin/debug/docs/metrics/health/actuator endpoint. Heuristic; NOT a finding by itself."
        },
        "missing_auth_suspect": {
          "type": "boolean",
          "description": "Advisory warning (NOT a finding): a state-changing (POST/PUT/DELETE/PATCH) or management route with no detected auth guard — looks like it should require authentication. Review candidate."
        },
        "missing_authz_suspect": {
          "type": "boolean",
          "description": "Advisory warning (NOT a finding): an authenticated, object-addressing route (path carries a resource id) with no detected role/ownership gate — the canonical BOLA/IDOR surface. Hypothesis only; 'unknown' authz != proven-absent."
        },
        "relevance_tags": {
          "type": "array",
          "items": {
            "type": "string",
            "enum": [
              "registration",
              "authentication",
              "management",
              "graphql-mutation",
              "graphql-object-access",
              "missing-auth",
              "missing-authz",
              "llm"
            ]
          },
          "uniqueItems": true,
          "description": "Display-relevance reasons (NOT findings): why a finding-free route still merits an individual row in §5 Attack Surface — it sits on the registration / authentication surface, is a management endpoint, or is a missing-auth/authz suspect. Consumed by pregenerate_fragments.gen_attack_surface to exempt these rows from the large-inventory collapse."
        },
        "confidence": {
          "type": "string",
          "enum": ["low", "medium", "high"]
        },
        "notes": {
          "type": "array",
          "items": { "type": "string" },
          "description": "Optional short explanatory tokens (free-text discouraged)."
        },
        "authn_handler_signal": {
          "type": "string",
          "enum": ["verified", "decode_only", "none", "unresolved"],
          "description": "What the resolved handler chain (registration arguments and mounted middlewares) proves: a checked credential with a rejecting branch, a token decoded without signature verification, no credential read in a fully resolved chain, or unresolved. Absent for stacks analyzers/handler_resolver.py does not cover."
        },
        "authn_handler_scheme": {
          "type": "string",
          "enum": ["cookie", "bearer", "other", "none"],
          "description": "Credential kind behind authn_handler_signal; `none` for decode_only and none."
        },
        "authn_handler_evidence": {
          "type": "array",
          "maxItems": 8,
          "items": {
            "type": "object",
            "additionalProperties": false,
            "required": ["file", "line"],
            "properties": {
              "file": { "type": "string" },
              "line": { "type": "integer", "minimum": 1 }
            }
          },
          "description": "Code that decided authn_handler_signal: the check, the decode, or the inspected handler definitions."
        },
        "handler_module": {
          "type": "string",
          "description": "Repo-relative file that defines the route's own handler (last registration argument seen through repository wrappers, or the decorated function), resolved through imports; guards, wrappers, mounted middlewares and injected dependencies never count. Links a finding in that file to the routes it serves."
        },
        "guard_lines": {
          "type": "array",
          "maxItems": 8,
          "items": {"type": "integer", "minimum": 1},
          "description": "Lines in handler_file of earlier guard registrations (`use` prefixes, wildcard `all` and exact verb mounts on the same router object) whose middleware names an authentication or authorization guard and covers this route; a STRIDE job reads them with the route (MR-19)."
        }
      }
    },
    "auth_signal": {
      "type": "string",
      "enum": [
        "present",
        "absent",
        "unknown",
        "middleware_present",
        "decorator_present",
        "inherited_unknown"
      ],
      "description": "Signal — NOT a verdict. 'present'/'absent' on authn come from the resolved handler chain (authn_handler_signal verified, or none/decode_only). 'unknown' / 'inherited_unknown' MUST NOT be silently coerced to 'absent' by downstream consumers."
    }
  }
}
