{
  "coverage": {
    "authenticated_count": 121,
    "authn_absent_count": 51,
    "authn_unknown_count": 78,
    "frameworks_detected": [
      "express"
    ],
    "management_surface_count": 7,
    "missing_auth_suspect_count": 53,
    "missing_authz_suspect_count": 40,
    "route_count": 250,
    "unsupported_route_files": []
  },
  "generated_at": "2000-01-01T00:00:00Z",
  "repo_root": "",
  "routes": [
    {
      "authn_handler_scheme": "none",
      "authn_handler_signal": "none",
      "authn_signal": "absent",
      "authz_signal": "unknown",
      "confidence": "medium",
      "framework": "express",
      "handler_file": "server.ts",
      "handler_line": 182,
      "management_surface": false,
      "method": "OPTIONS",
      "missing_auth_suspect": false,
      "missing_authz_suspect": false,
      "notes": [],
      "path": "*",
      "relevance_tags": [],
      "route_id": "R-001"
    },
    {
      "authn_handler_evidence": [
        {
          "file": "routes/fileServer.ts",
          "line": 14
        },
        {
          "file": "server.ts",
          "line": 197
        },
        {
          "file": "server.ts",
          "line": 203
        },
        {
          "file": "routes/metrics.ts",
          "line": 63
        },
        {
          "file": "lib/antiCheat.ts",
          "line": 51
        }
      ],
      "authn_handler_scheme": "none",
      "authn_handler_signal": "none",
      "authn_signal": "absent",
      "authz_signal": "unknown",
      "confidence": "medium",
      "framework": "express",
      "handler_file": "server.ts",
      "handler_line": 270,
      "handler_module": "routes/fileServer.ts",
      "management_surface": false,
      "method": "ALL",
      "missing_auth_suspect": false,
      "missing_authz_suspect": false,
      "notes": [],
      "path": "/ftp(?!/quarantine)/:file",
      "relevance_tags": [],
      "route_id": "R-002"
    },
    {
      "authn_handler_evidence": [
        {
          "file": "routes/quarantineServer.ts",
          "line": 9
        },
        {
          "file": "server.ts",
          "line": 197
        },
        {
          "file": "server.ts",
          "line": 203
        },
        {
          "file": "routes/metrics.ts",
          "line": 63
        },
        {
          "file": "lib/antiCheat.ts",
          "line": 51
        },
        {
          "file": "server.ts",
          "line": 241
        }
      ],
      "authn_handler_scheme": "none",
      "authn_handler_signal": "none",
      "authn_signal": "absent",
      "authz_signal": "unknown",
      "confidence": "medium",
      "framework": "express",
      "handler_file": "server.ts",
      "handler_line": 271,
      "handler_module": "routes/quarantineServer.ts",
      "management_surface": false,
      "method": "ALL",
      "missing_auth_suspect": false,
      "missing_authz_suspect": false,
      "notes": [],
      "path": "/ftp/quarantine/:file",
      "relevance_tags": [],
      "route_id": "R-003"
    },
    {
      "authn_handler_evidence": [
        {
          "file": "routes/keyServer.ts",
          "line": 9
        },
        {
          "file": "server.ts",
          "line": 197
        },
        {
          "file": "server.ts",
          "line": 203
        },
        {
          "file": "routes/metrics.ts",
          "line": 63
        },
        {
          "file": "lib/antiCheat.ts",
          "line": 51
        },
        {
          "file": "server.ts",
          "line": 241
        }
      ],
      "authn_handler_scheme": "none",
      "authn_handler_signal": "none",
      "authn_signal": "absent",
      "authz_signal": "unknown",
      "confidence": "medium",
      "framework": "express",
      "handler_file": "server.ts",
      "handler_line": 278,
      "handler_module": "routes/keyServer.ts",
      "management_surface": false,
      "method": "ALL",
      "missing_auth_suspect": false,
      "missing_authz_suspect": false,
      "notes": [],
      "path": "/encryptionkeys/:file",
      "relevance_tags": [],
      "route_id": "R-004"
    },
    {
      "authn_handler_evidence": [
        {
          "file": "routes/logfileServer.ts",
          "line": 9
        },
        {
          "file": "server.ts",
          "line": 197
        },
        {
          "file": "server.ts",
          "line": 203
        },
        {
          "file": "routes/metrics.ts",
          "line": 63
        },
        {
          "file": "lib/antiCheat.ts",
          "line": 51
        },
        {
          "file": "server.ts",
          "line": 241
        },
        {
          "file": "routes/verify.ts",
          "line": 63
        }
      ],
      "authn_handler_scheme": "none",
      "authn_handler_signal": "none",
      "authn_signal": "absent",
      "authz_signal": "unknown",
      "confidence": "medium",
      "framework": "express",
      "handler_file": "server.ts",
      "handler_line": 283,
      "handler_module": "routes/logfileServer.ts",
      "management_surface": false,
      "method": "ALL",
      "missing_auth_suspect": false,
      "missing_authz_suspect": false,
      "notes": [],
      "path": "/support/logs/:file",
      "relevance_tags": [],
      "route_id": "R-005"
    },
    {
      "authn_handler_evidence": [
        {
          "file": "server.ts",
          "line": 692
        },
        {
          "file": "routes/fileUpload.ts",
          "line": 19
        },
        {
          "file": "routes/metrics.ts",
          "line": 73
        },
        {
          "file": "routes/fileUpload.ts",
          "line": 55
        },
        {
          "file": "routes/fileUpload.ts",
          "line": 62
        },
        {
          "file": "routes/fileUpload.ts",
          "line": 39
        },
        {
          "file": "routes/fileUpload.ts",
          "line": 70
        },
        {
          "file": "routes/fileUpload.ts",
          "line": 101
        }
      ],
      "authn_handler_scheme": "none",
      "authn_handler_signal": "none",
      "authn_signal": "absent",
      "authz_signal": "unknown",
      "confidence": "medium",
      "framework": "express",
      "handler_file": "server.ts",
      "handler_line": 309,
      "handler_module": "routes/fileUpload.ts",
      "management_surface": false,
      "method": "POST",
      "missing_auth_suspect": true,
      "missing_authz_suspect": false,
      "notes": [],
      "path": "/file-upload",
      "relevance_tags": [
        "missing-auth"
      ],
      "route_id": "R-006"
    },
    {
      "authn_handler_evidence": [
        {
          "file": "routes/profileImageFileUpload.ts",
          "line": 35
        }
      ],
      "authn_handler_scheme": "cookie",
      "authn_handler_signal": "verified",
      "authn_signal": "present",
      "authz_signal": "unknown",
      "confidence": "medium",
      "framework": "express",
      "handler_file": "server.ts",
      "handler_line": 310,
      "handler_module": "routes/profileImageFileUpload.ts",
      "management_surface": false,
      "method": "POST",
      "missing_auth_suspect": false,
      "missing_authz_suspect": false,
      "notes": [
        "authorization-review-required"
      ],
      "path": "/profile/image/file",
      "relevance_tags": [],
      "route_id": "R-007"
    },
    {
      "authn_handler_evidence": [
        {
          "file": "routes/profileImageUrlUpload.ts",
          "line": 21
        }
      ],
      "authn_handler_scheme": "cookie",
      "authn_handler_signal": "verified",
      "authn_signal": "present",
      "authz_signal": "unknown",
      "confidence": "medium",
      "framework": "express",
      "handler_file": "server.ts",
      "handler_line": 311,
      "handler_module": "routes/profileImageUrlUpload.ts",
      "management_surface": false,
      "method": "POST",
      "missing_auth_suspect": false,
      "missing_authz_suspect": false,
      "notes": [
        "authorization-review-required"
      ],
      "path": "/profile/image/url",
      "relevance_tags": [],
      "route_id": "R-008"
    },
    {
      "authn_handler_signal": "unresolved",
      "authn_signal": "unknown",
      "authz_signal": "unknown",
      "confidence": "medium",
      "framework": "express",
      "handler_file": "server.ts",
      "handler_line": 312,
      "handler_module": "routes/memory.ts",
      "management_surface": false,
      "method": "POST",
      "missing_auth_suspect": true,
      "missing_authz_suspect": false,
      "notes": [],
      "path": "/rest/memories",
      "relevance_tags": [
        "missing-auth"
      ],
      "route_id": "R-009"
    },
    {
      "authn_handler_evidence": [
        {
          "file": "lib/insecurity.ts",
          "line": 52
        }
      ],
      "authn_handler_scheme": "bearer",
      "authn_handler_signal": "verified",
      "authn_signal": "middleware_present",
      "authz_signal": "unknown",
      "confidence": "medium",
      "framework": "express",
      "handler_file": "server.ts",
      "handler_line": 363,
      "management_surface": false,
      "method": "GET",
      "missing_auth_suspect": false,
      "missing_authz_suspect": false,
      "notes": [],
      "path": "/api/Users",
      "relevance_tags": [],
      "route_id": "R-010"
    },
    {
      "authn_handler_evidence": [
        {
          "file": "lib/insecurity.ts",
          "line": 52
        }
      ],
      "authn_handler_scheme": "bearer",
      "authn_handler_signal": "verified",
      "authn_signal": "middleware_present",
      "authz_signal": "unknown",
      "confidence": "medium",
      "framework": "express",
      "handler_file": "server.ts",
      "handler_line": 369,
      "management_surface": false,
      "method": "POST",
      "missing_auth_suspect": false,
      "missing_authz_suspect": false,
      "notes": [
        "authorization-review-required"
      ],
      "path": "/api/Products",
      "relevance_tags": [],
      "route_id": "R-011"
    },
    {